,Iqama_no,BeneficiaryNumber,BeneficiaryType,ClassName,DeductibleRate,ExpiryDate,Gender,IdentityNumber,InsuranceCompanyAR,InsuranceCompanyEN,InsuranceCompanyID,IssueDate,MaxLimit,Name,NetworkID,PolicyHolder,PolicyNumber,SponsorNumber,Insertion_Date
0,2077330583,002077330583001,1,mb4s,20,2025-08-05,1,2077330583,شركة ملاذ للتأمين وإعادة التأمين التعاوني,Malath Cooperative Insurance & Reinsurance Company,122,2024-08-06,300,sarhan mohsen - abdulkhallaq,11,khaled saeed bashmagh est,24436070,7007113298,2025-05-02 09:35
2,2559435504,9069232,1,class c+,20,2025-05-21,1,2559435504,شركة تكافل الراجحي للتأمين التعاوني,Alrajhi Takaful for Cooperative Insurance,123,2024-05-22,75,ansar ali shaukat ali,2585,branch of china railway 18th bureau group co.ltd,1040017797,7001511331,2025-05-02 09:35
3,2356086237,2356086237,1,r,20.00,2025-05-27,1,2356086237,شركة الإتحاد للتأمين التعاوني,AlEtihad Cooperative Insurance Co,114,2024-05-28,75.00,alberto jr manzano  quitos,10007,alkhayyat red brick factory,2311000,7003622060,2025-05-02 09:35
5,2279972182,2279972182,2,e,20,2025-07-16,1,2279972182,مجموعة الخليج للتأمين,GULF INSURANCE GROUP (GIG),113,2024-07-17,75,mohammed hussain mohammed almizjaji,5,fayez omar rashid,1030429,7006746106,2025-05-02 09:35
7,1205730193,001072010919201,2,vip,10,2025-10-31,2,1205730193,الشركة التعاونية للتأمين التعاوني,Tawuniya cooperative Insurance Company,101,2024-11-01,100,1 - ghym nassir alatyby (0) -a,11,royal guard,8907,7000996566,2025-05-02 09:35
9,2336660184,10036008,1,basic s.1.z5,20,2025-09-25,1,2336660184,شركة تكافل الراجحي للتأمين التعاوني,Alrajhi Takaful for Cooperative Insurance,123,2024-09-25,75,saleh mohammed omar alahmadi,2828,ظ…ط¤ط³ط³ط© ظپظٹطµظ„ ط§ط­ظ…ط¯ ظ…ط­ظ…ط¯ ط³ط¹ظٹط¯ ط¨ط؛ظ„ظپ ظ„ظ„طھط¨ط±ظٹط¯ ظˆط§ظ„طھظƒظٹظٹظپ,1040038217,7013059048,2025-05-02 09:35
10,1104031578,37932273,1,a,0.00,2026-03-03,1,1104031578,شركة بوبا العربية للتأمين التعاوني,BUPA Arabia for Cooperative Insurance,102,2025-03-04,0.00,abdullah bamshaya,97201,the jeddah edtion,516099001,7025566071,2025-05-02 09:35
12,2173615853,32527333,2,c,20.00,2025-06-20,1,2173615853,شركة بوبا العربية للتأمين التعاوني,BUPA Arabia for Cooperative Insurance,102,2024-06-21,100.00,qarni hamad allah bayyumi,300144,bin shihon group co,494937050,7001499818,2025-05-02 09:35
